{
  "schema": "https://pgs.local/schemas/module.manifest.schema.json",
  "class": "command",
  "name": "sched",
  "version": "1.0.0",
  "abi": 2,
  "summary": "Cron, one-shot, and interval scheduling for restricted guard commands.",
  "risk": "medium",
  "capabilities": [
    "sched.add",
    "sched.list",
    "sched.remove",
    "sched.enable",
    "sched.disable",
    "guard.register",
    "guard.unregister",
    "guard.intentional",
    "guard.policy",
    "guard.list"
  ],
  "methods": [
    {"name": "sched.add", "risk": "medium", "sync": true, "required_capabilities": ["sched.add"], "params_schema": {"type": "object"}, "result_schema": {"type": "object"}},
    {"name": "sched.list", "risk": "low", "sync": true, "required_capabilities": ["sched.list"], "params_schema": {"type": "object"}, "result_schema": {"type": "object"}},
    {"name": "sched.remove", "risk": "medium", "sync": true, "required_capabilities": ["sched.remove"], "params_schema": {"type": "object"}, "result_schema": {"type": "object"}},
    {"name": "sched.enable", "risk": "medium", "sync": true, "required_capabilities": ["sched.enable"], "params_schema": {"type": "object"}, "result_schema": {"type": "object"}},
    {"name": "sched.disable", "risk": "medium", "sync": true, "required_capabilities": ["sched.disable"], "params_schema": {"type": "object"}, "result_schema": {"type": "object"}}
  ]
}
